,Review ID,Review,Review_tokenized
0,1,เป็นคนที่ชอบทาน Macchiato เป็นประจำ มีวันนึงเดินเข้าไปสั่ง ความคิดแรกที่เห็นปริมาณของกาแฟร้อนก็เฟลแล้ว มีอยู่ครึ่งแก้วน้อยๆได้ พอตอนดื่มยิ่งเฟลหนักกว่าเดิม หาความเป็น Macchiato ไม่เจอเลย หลังจากนี้ลาขาด กินกาแฟโบราณแก้วละ 20 บาทยังมีความสุขมากกว่าอีก,"คน,ชอบ,ทาน,Macchiato,เป็นประจำ,นึง,เดิน,เข้าไป,สั่ง,ความคิด,ปริมาณ,กาแฟร้อน,เฟล,ครึ่ง,แก้ว,ตอน,ดื่ม,เฟล,หนัก,เดิม,Macchiato,เจอ,หลังจากนี้,ลา,กิน,กาแฟ,โบราณ,แก้ว,20,บาท,มีความสุข"
1,2,"Art of Coffee Kasetsart เป็นร้านกาแฟรสชาติเยี่ยม ราคาไม่แพง บรรยากาศนั่งสบาย 

พนักงานที่ร้านน่ารักมาก อัธยาศัยดี พูดจากับลูกค้าเพราะมาก ทำให้อยากไปอุดหนุนบ่อยๆ ^^

เมนูที่ต้องสั่ง 

-เอ๊กซ์เพรสโซ่ไอซ์ ลาเต้ไอซ คาราเมล มัคคิอาโต้

-ชาอัสสัมชาซีลอน

-อิตาเลียนโซดา","Art,of,Coffee,Kasetsart,กาแฟ,รสชาติ,เยี่ยม,ราคา,แพง,บรรยากาศ,นั่ง,พนักงาน,น่ารัก,อัธยาศัย,ดี,พูดจา,ลูกค้า,อุดหนุน,ชอบ,เมนู,สั่ง,เอ๊กซ์,เพรส,โซ่,ไอซ์,ลาเต้,ไอ,คาราเมล,มัค,คิ,อา,โต้,ชา,อัสสัม,ชา,ซี,ลอน,อิตาเลียน,โซดา"
2,3,"กวงทะเลเผา อาหารทะเลเค้าสดจริงๆเนื้อปูหวานไม่คาวเลยเนื้อกุ้งก็ทั้งหอมและมัน น้ำจ้ิมก็อร่อยเจ้มจ้นมีอาหารอร่อยหลากหลายรายการ ออส่วนมาในกระทะร้อนฉ่า เสริ์ฟทีมีแต่คนหันมามองเพราะเสียงดังมากกกกก เรียกความสนใจได้ดี แต่อร่อยนะแนะนำเลย ปลาหมึกไข่เค็มเมนูนี้แคเลทเตอรอลอาจจะสูงไปสักหน่อยแต่ห้ามพลาดเด็ดขาดเลยค่ะเพราะอร่อยมากยากบรรยาย ยิ่งทานตอนร้อนๆๆนะ 
ฮื้อ ขออีกจาน กุ้งอบวุ้นเส้นรสชาติดีก็อร่อยใช้ได้แต่มันมากๆ หมูสามชั้นก้นกระทะน้ำม้นงี้เยิ่มเลยถ้าทานช้าหายร้อนแล้วจะไม่อร่อยทันทีปูผัดพริกไทยดำ เนื้อปูสดรสชาติเข้มข้น หอมกลิ่นเครื่องเทศผัดจนเข้าไปผสมกับเนื้อปูกันเลยทีเดียว จานนี้ก็ห้ามพลาดเด็ดขาด ควรสั่งอย่างยิ่งโป๊ะแตก รสไม่จัดจ้านเท่าไรแต่ขอบอกแก้เลี่ยนได้ดีและคนไม่กินเผ็ดจะถูกใจมากเช่นนานา เพราะพอเข้าปากนะหือชุ่มคอ กินน้ำหมดหม้อเลยข้าวผัดปูไม่แนะนำตามหลักอาหารจีนถึงเราสั่งเป็นรายการแรกแต่ชอบเอามาส่งทีหลังแล้วจะทานกะอะไรล่ะกินกับจะเกลี้ยงหมดแล้วที่สำคัญไม่อร่อยค่ะถ้าจะสั่งก็จานเล็กๆพอ ปลากระพงทอดน้ำปลาเมนูนี้ก็ห้ามพลาดนะ ปลางี้กร๊อบกรอบ เนื้อปลาก็สดด้วยใส่น้ำจ้ิมเข้าไปแจ่มมากกกกหอยลายผัดพริกเผา ถึงเครื่องพริกเผาเข้าเนื้อกันสุดๆยำวุ้นเส้นรวมมิตรทะเลอยากรู้จังเค้าใช้วุ้นเส้นยี่ห้ออะไรมันเหนียวนุ่ม น้ำยำก็จี๊ดจ๊าด เมนูพื้นๆแต้ก็ห้ามพลาดเด็ดขาดเลยค่ะส้มตำปูม้า ก็งั้นๆแหละคอส้มตำจะรู้ว่ายังไม่แซ่บไม่ผ่านค่ะสลัดกุ้งกรอบ จานนี่ไม่ได้ชิม เพราะอิ่มแบบไม่ไหวแล้ว แต่เพื่อนนะตักกินไม่หยุดแล้วพูดว่าอร่อย ตักใส่ปากอีกก็บอกอีกอร่อยจัง อร่อยมาก เลยคิดว่าจานนี้คงจะอร่อยมากอ่ะนะตบท้ายด้วยข้าวเหนียวมะม่วงหอม มัน อร่อยแต่จานใหญ่มากกก ขอพูดถึงบรรยากาศร้านหน่อยนึงก่อนจะปิดจ๊อบ ร้านไม่ค่อยสะอาดเท่าไรค่ะที่ให้สามดาวเพราะบรรยากาศร้านนี่แหละแต่ก็ร้านอาหารจีนส่วนใหญ่เค้าก็ประมาณนี้กัน เสียงดัง กลิ่นไม่หอม การกินแข่งขันสูง555 เหมือนมาแข่งกินประมาณนั้น แต่ทุกเมนูก็ต้องให้สี่ดาวขึ้นนะ เพราะอาหารอร่อยจริ๊งจริงค่ะ ","กวง,ทะเล,เผา,อาหารทะเล,เค้า,สด,เนื้อ,ปู,หวาน,คาว,เนื้อ,กุ้ง,หอม,น้ำ,จ้ิม,อร่อย,เจ้,จ้น,อาหาร,อร่อย,หลากหลาย,รายการ,ออ,กระทะ,ร้อน,ฉ่า,เส,ริ์ฟ,คน,หันมา,เสียงดัง,กก,กก,ความสนใจ,ได้ดี,อร่อย,แนะนำ,ปลาหมึก,ไข่เค็ม,เมนู,แค,เลท,เต,อร,อล,สักหน่อย,ห้าม,พลาด,เด็ดขาด,อร่อย,บรรยาย,ทาน,ตอน,ร้อน,ฮื้อ,จาน,กุ้ง,อบ,วุ้นเส้น,รสชาติ,ดี,อร่อย,ใช้ได้,หมูสามชั้น,ก้น,กระทะ,น้ำ,ม้น,งี้,เยิ่ม,ทาน,หาย,ร้อน,แล้,วจะ,อร่อย,ปู,ผัด,พริก,ไทยดำ,เนื้อ,ปู,สด,รสชาติ,เข้มข้น,หอม,กลิ่น,เครื่องเทศ,ผัด,เข้าไป,ผสม,เนื้อ,ปู,จาน,ห้าม,พลาด,เด็ดขาด,สั่ง,โป๊ะแตก,รส,จัดจ้าน,แก้,เลี่ยน,ได้ดี,คน,กิน,เผ็ด,ถูกใจ,นานา,ปาก,หือ,ชุ่มคอ,กินน้ำ,หม้อ,ข้าวผัด,ปู,แนะนำ,หลัก,อาหารจีน,สั่ง,รายการ,ชอบ,ทีหลัง,แล้,วจะ,ทาน,กะ,ล่ะ,กิน,เกลี้ยง,อร่อย,สั่ง,จาน,ปลา,กระ,พง,ทอด,น้ำปลา,เมนู,ห้าม,พลาด,ปลา,งี้,กร๊อบ,กรอบ,เนื้อ,ปลา,สด,ใส่,น้ำ,จ้ิม,เข้าไป,แจ่ม,กก,กก,หอย,ลาย,ผัด,พริก,เผา,เครื่อง,พริก,เผา,เข้าเนื้อ,ยำ,วุ้นเส้น,รวมมิตร,ทะเล,อยากรู้,เค้า,วุ้นเส้น,ยี่ห้อ,เหนียว,นุ่ม,น้ำ,ยำ,จี๊ดจ๊าด,เมนู,พื้น,แต้,ห้าม,พลาด,เด็ดขาด,ส้มตำ,ปูม้า,งั้น,คอ,ส้มตำ,รู้,แซ่บ,สลัด,กุ้ง,กรอบ,จาน,ชิม,อิ่ม,ไหว,เพื่อน,ตัก,กิน,หยุด,พูดว่า,อร่อย,ตัก,ใส่,ปาก,อร่อย,อร่อย,จาน,อร่อย,อ่ะ,ตบท้าย,ข้าวเหนียว,มะม่วง,หอม,อร่อย,จาน,กก,พูดถึง,บรรยากาศ,นึง,จ๊อบ,สะอาด,สาม,ดาว,บรรยากาศ,อาหารจีน,เค้า,เสียงดัง,กลิ่น,หอม,กิน,แข่งขัน,555,เหมือน,แข่ง,กิน,เมนู,สี่,ดาว,อาหาร,อร่อย,จริ๊ง"
3,4,"วันนี้มีโอกาสตื่นเช้าครับเลยถึงโอกาสออกมาหาอะไรอร่อยๆทานตอนเช้าๆครับ สําหรับเช้าๆนั้นจะมีตัวเลือกไม่มากเท่าไรโดยเฉพาะก๋วยจั๊บอร่อยๆเพราะของแบบนี้ต่อให้ใส่ถุงมาจากร้านดังเมื่อคืน เอามาอุ่นตอนเช้าความอร่อยจะลดจากทานที่ร้านไปเยอะทีเดียว 

ก๋วยจั๊บร้านนี้เป็นนํ้าข้นครับ ร้านไม่มีชื่อหาไม่ยากครับหน้าปากซอยมีร้านขายโจ๊กมองเข้ามาเห็นคนมุงเยอะๆ ร้านนั้นแหละครับ คนส่วนใหญ่จะสั่งใส่ถุงครับแต่จะทานที่ร้านก็ได้ โต๊ะมีน้อยมากกกกก 

ถ้าจะมาแนะนําให้มาเช้าหน่อยครับประมาณ 8 โมงเครื่องยังครบอยู่ ถ้ามาสายอาจได้ทานแต่หนังกับเต้าหู้ เพราะเจ๊ให้เครื่องไม่อั้น

ปล. ตบท้ายด้วยร้านขนมปังฝรั่งเศสหน้าปากซอย พร้อมกาแฟและอ่านข่าวไปด้วยเป็นการเริ่มวันที่ดีทีเดียว","มีโอกาส,ตื่น,เช้า,โอกาส,มาหา,อร่อย,ทาน,ตอนเช้า,สํา,หรับ,เช้า,ตัวเลือก,โดยเฉพาะ,ก๋วยจั๊บ,อร่อย,แบบนี้,ต่อให้,ใส่,ถุง,มาจาก,อุ่น,ตอนเช้า,อร่อย,ลด,ทาน,ก๋วยจั๊บ,นํ้า,ข้น,มีชื่อ,หาไม่,ยา,กค,รับหน้า,ปากซอย,ขาย,โจ๊ก,เข้ามา,คน,มุง,นั้นแหละ,คน,สั่ง,ใส่,ถุง,ทาน,โต๊ะ,กก,กก,แนะ,เช้า,โมง,เครื่อง,มาสาย,ทาน,หนัง,เต้าหู้,เจ๊,เครื่อง,อั้น,ปล,ตบท้าย,ขนมปังฝรั่งเศส,หน้า,ปากซอย,กาแฟ,อ่าน,ข่าว,วันที่,ดี"
4,5,"ชอบมาทานร้านนี้ถ้าอยากกินอาหารเวียดนามใกล้บ้าน อยู่ในซอยราชครูเข้ามานิดเดียวทางซ้ายมือ
ที่จอดรถค่อนข้างน้อยเพราะต้องแชร์กับร้านค้าในเวิ้งเดียวกัน บางครั้งอาจต้องออกไปจอดตามซอยข้างๆ

อาหารที่นี่มีหลายหลากเมนู อร่อยทุกเมนูที่เคยทาน น้ำจิ้มให้มาอย่างสะใจ ขอเพิ่มได้ตลอด 
ร้านตกแต่งเหมือนร้านอาหารเวียดนามทั่วไป คือต้องมีรูปเกี่ยวกับเวียดนามและหญิงสาวเวียดนามแต่งตัวมาอวดทรวดทรงที่ผอมบางเพราะทานกันแต่ผัก 
ผิดหวังอย่างเดียวคือกาแฟเวียดนามไม่ได้มาในถ้วยกดให้น้ำหยด แต่ชงมาให้สำเร็จ รสชาติเลยไม่เข้มข้นและออกหวานเกินไป สั้งพวกน้ำผลไม้ปั่นแทน
ราคาเหมาะสมกับคุณภาพและปริมาณ
","ชอบ,ทาน,กิน,อาหาร,เวียดนาม,บ้าน,ซอย,ราชครู,เข้ามา,นิดเดียว,ซ้ายมือ,ที่จอดรถ,ข้างน้อย,แชร์,ค้า,เวิ้ง,จอด,ซอย,อาหาร,ที่นี่,หลายหลาก,เมนู,อร่อย,เมนู,ทาน,น้ำจิ้ม,สะใจ,ตกแต่ง,เหมือน,อาหาร,เวียดนาม,ทั่วไป,รูป,เวียดนาม,หญิงสาว,เวียดนาม,แต่งตัว,อวด,ทรวดทรง,ผอมบาง,ทาน,ผัก,ผิดหวัง,กาแฟ,เวียดนาม,ถ้วย,กด,ให้น้ำ,หยด,ชง,สำเร็จ,รสชาติ,เข้มข้น,หวาน,เกินไป,สั้ง,น้ำผลไม้,ปั่น,แทน,ราคา,เหมาะสม,คุณภาพ,ปริมาณ"
5,6,"เป็นร้านที่สะดุดตาที่สุดบนถนนจรัญ เลยก็ว่าได้ ถ้าวิ่งฝั่งรพ.ยันฮีไปปิ่นเกล้า ก็ให้สังเกตุแบงค์กรุงเทพ ร้านจะอยู่ติดแบงค์กรุงเทพเลย รั้วบ้านสีแดง เด็มไปด้ายต้นไม้ มีสวนร่มรื่น กาแฟอร่อย วันนั้นเห็นอาหารน่าทานเลยสั่งข้าวผัดกุ้งไป รอนานหน่อยเพราะคนเยอะ แม่ครัวน้อย แต่อาหารรสชาติดี ราคาไม่แพง กาแฟเย็นชื่นใจ อร่อย
*ร้านนี้ไม่มีหมู
*ร้านหยุดทุกวันพุธ (อาจเปลี่ยนแปลง)","สะดุดตา,ถนน,จรัญ,วิ่ง,ฝั่ง,รพ,ยันฮี,ปิ่น,เกล้า,สัง,เกตุ,แบงค์,กรุงเทพฯ,ติด,แบงค์,กรุงเทพฯ,รั้ว,บ้าน,สีแดง,เด็ม,ด้าย,ต้นไม้,สวน,ร่มรื่น,กาแฟ,อร่อย,อาหาร,ทาน,สั่ง,ข้าวผัด,กุ้ง,รอ,คน,แม่ครัว,อาหาร,รสชาติ,ดี,ราคา,แพง,กาแฟเย็น,ชื่นใจ,อร่อย,หมู,หยุด,พุธ"
