,Review ID,Review,Review_tokenized
144,145,"วันที่ไปทานเป็น Brunch set ค่ะ ราคาก็ต่างกันตั้งแต่ 190-400 กว่าบาท
โดยในเซตจะมีของทานเล่น เครื่องดื่ม และไอศกรีมให้ด้วย(คุ้มมากๆ)

สั่ง pork fillet brunch set ไปค่ะ รวม vat+ser แล้ว 421 บาท

*ในเซ็ตมีไก่นักเก็ต พร้อมดิปบลูชีส(หรือมาโย)  กลิ่นมันฉุนแปลกๆ  และไม่เหมือนnugget bluecheese ในเมนู -_- แต่ก็ทอดมาได้ดี ไม่อมน้ำมัค่ะ กินกับซอสพริกน่าจะอร่อยกว่า(แล้วแต่คนชอบนะ)

*กาแฟเย็น ให้เติมไซรัปเอง จืดๆค่ะ นมเยอะไปหน่อย+น้ำแข็งเยอะ

*สลัด ผักสดดี น้ำสลัด vinegar อร่อย

*ตัว pork chop ยัดไส้ด้วยเห็ดและชีส ทำมาได้อร่อยดีค่ะ ซอสก็อร่อย potato wedges อร่อยมาก แต่รออาหารนานมากกกกกกกกกก  ทั้งๆที่ร้านมีเราคนเดียว(ไป 11.10 น.)

หักคะแนนที่อาหารรอนานค่ะ

","วันที่,ทาน,Brunch,set,ราคา,ต่างกัน,190,400,บาท,เซต,ทาน,เล่น,เครื่องดื่ม,ไอศกรีม,คุ้ม,สั่ง,pork,fillet,brunch,set,vat,ser,421,บาท,เซ็ต,ไก่,เก็ต,ดิ,บลู,ชีส,โย,กลิ่น,ฉุน,แปลก,เหมือน,nugget,bluecheese,เมนู,ทอด,ได้ดี,อม,น้ำ,มัค,่ะ,กิน,ซอส,พริก,อร่อย,คน,ชอบ,กาแฟเย็น,เติม,ไซรัป,จืด,นม,น้ำแข็ง,สลัด,ผักสด,ดี,น้ำสลัด,vinegar,อร่อย,ตัว,pork,chop,ยัดไส้,เห็ด,ชีส,ทำ,อร่อย,ดี,ซอส,อร่อย,potato,wedges,อร่อย,รอ,อาหาร,กก,กก,กก,กก,กก,คนเดียว,1110,หักคะแนน,อาหาร,รอ"
145,146,"แวะมาทานอาหาร โดยทางร้านมีให้เลือกทั้ง
- อาหารอีสานทั่วไป (ส้มตำ ลาบ ...)
- โคขุน
- อาหารตามสั่งและเมนูตามร้านเหล้า (เช่น ยำทั้งหลาย ไส้กรอก)

เคยมาทานพนักงานดูแลดีมาก แต่คราวนี้เหมือนจะอึนๆกันอยู่ (สงสัยเซ็งกับผลบอลไทยเมื่อวาน)","แวะ,ทานอาหาร,เลือก,อาหาร,อีสาน,ทั่วไป,ส้มตำ,ลาบ,โค,ขุน,อาหาร,สั่ง,เมนู,เหล้า,ยำ,ไส้กรอก,ทาน,พนักงาน,ดูแล,ดีมาก,เหมือน,อึน,สงสัย,เซ็ง,บอล,ไทย"
146,147,"ข้อมูลที่ลงรีวิวเป็นความเห็นส่วนตัวที่ได้พบเจอมานะคะ 
ที่ตั้ง + ลักษณะร้าน :
ร้านเป็นห้องขนาดเล็กๆ 1 ห้อง ร้านอยู่ที่ซอยสุขุมวิท 101/1 
เดินเข้าซอยมาอยู่ตรงวินมอเตอร์ไซค์พอดี  อยู่ข้างร้านสดชื่น ชานมไข่มุกค่ะ
มีการทำขนมด้านในร้าน ด้านหน้ามีชั้นขนม ตู้โชว์ขนมพอสมควร
เป็นร้านแบบซื้อกลับบ้าน
รสชาติ การบริการ ฯลฯ : 
ซื้อชอคบอลมา 1 กล่อง มีอยู่ 5 ลูก กล่องละ 20 บาท 
เนื้อขนมเป็นแบบฉ่ำๆ แฉะๆไปหน่อย แต่ไม่เละเทะค่ะ
 รสชอกโกแลตเข้มข้น ใส่ตู้เย็นสักหน่อย เราว่ากินอร่อยกว่าค่ะ","ข้อมูล,รีวิว,ความเห็นส่วนตัว,เจอ,นะคะ,ที่ตั้ง,ลักษณะ,ห้อง,ขนาดเล็ก,ห้อง,ซอย,สุขุมวิท,101,เดิน,ซอย,วิน,มอเตอร์ไซค์,สดชื่น,ชา,นม,ไข่มุก,ทำ,ขนม,ด้านใน,ด้านหน้า,ชั้น,ขนม,ตู้,โชว์,ขนม,ซื้อ,กลับบ้าน,รสชาติ,บริการ,ซื้อ,ชอค,บอล,กล่อง,ลูก,กล่อง,20,บาท,เนื้อ,ขนม,ฉ่ำ,แฉะ,เละเทะ,รส,ชอก,โก,แล,เข้มข้น,ใส่,ตู้เย็น,สักหน่อย,กิน,อร่อย"
147,148,มาแบบงงๆ หายากนิดนึง แต่ถ้าหาเจอแล้วไม่ผิดหวังเลยคะ ที่นี่นอกจากจะเป็นร้านกาแฟและร้านอาหารสไตล์อิตาเลียนแล้ว รู้สึกว่าจะเปิดสอนทำอาหารด้วย ซึ่งอาหารอร่อยยมากคะ แนะนำคาร์โบนาล่า เลย เข้มข้นสุดๆ เค้กก็อร่อยยยย,"งง,หา,นิดนึง,หา,เจอ,ผิดหวัง,ที่นี่,กาแฟ,อาหาร,สไตล์,อิตาเลียน,รู้สึก,สอน,ทำอาหาร,อาหาร,อร่อย,แนะนำ,คาร์,โบ,นา,ล่า,เข้มข้น,เค้ก,อร่อย,ยยย"
148,149,"ร้านไอศครีมน่ารักๆ เหมาะกับพาครอบครัวมานั่งทานอาหารว่างกันตอนบ่ายๆหรือตอนค่ำๆก่อนกลับบ้านมากๆ
วิธีไป จำง่ายๆเข้าซอย Chic Republic วิ่งเข้าไปซัก 500 เมตรอยู่ฝั่งขวา อยู่ตรงข้าม 13 เหรียญเลย

ไอศครีมโฮมเมดแสนอร่อย 
- รสโปรดคือ มะม่วง เปรี้ยวอมหวาน และหอมมากมาย (แอบชอบมากกว่าฮาเก้นดาสอีก)
- รสนี้ไม่เหมือนร้านอื่น มะนาว งงละสิว่าไม่เหมือนยังไง มันเปรี้ยวจี้ดได้ใจมากๆ ถูกใจที่สุด เหมือนกินมะนาวจริงๆ รสชาติไม่เหมือนรสมะนาวสีเขียวที่เราทานกันตอนเด็กๆนะ อันนั้นมีแต่กลิ่นมะนาว
- รสชอคโกแลตส้ม กับ กาแฟเอคเปรสโซ่ ก็เข้มข้นมากๆ ใครชอบขมๆต้องลอง
และยังมีอีกหลายสิบรสสับเปลี่ยนกันไม่เลือกซ้ำ

เครื่องดื่ม
- กาแฟแก้วโต 
- โมจิโต้ คือมะนาวปั่นใส่มิ้นท์นั่นเอง
- สตอร์เบอรรี่ปั่น (มีแต่ของเปรียวๆ :P)

ของกินเล่น และของหนัก
- ยำองุ่นหมูย่าง 
- สลัดหลายแบบ
- สปาเกตตี้หลายอย่าง

ราคาไอศครีม สกู๊ปละ 49 บาท ถ้าจำไม่ผิดนะ
อาหารจานละ 120 - 200 บาท โดยประมาณ

ถ้าเบื่อร้านไอศครีมเดิมๆในห้าง มาลองชิมร้านนี้ดู แล้วจะติดใจ ^^","ไอศครีม,น่ารัก,เหมาะกับ,ครอบครัว,นั่ง,ทาน,อาหารว่าง,ตอนบ่าย,ตอนค่ำ,กลับบ้าน,วิธี,ซอย,Chic,Republic,วิ่ง,เข้าไป,ซัก,500,เมตร,ฝั่ง,ขวา,ตรงข้าม,13,เหรียญ,ไอศครีม,โฮมเมด,แสน,อร่อย,รส,โปรด,มะม่วง,เปรี้ยว,อม,หวาน,หอม,แอบ,ชอบ,ฮา,เก๋,ดา,รส,เหมือน,มะนาว,งง,สิ,เหมือน,เปรี้ยว,จี้,ได้ใจ,ถูกใจ,เหมือน,กิน,มะนาว,รสชาติ,เหมือน,รส,มะนาว,สี,เขียว,ทาน,ตอน,เด็ก,อันนั้น,กลิ่น,มะนาว,รส,ชอค,โก,แล,ส้ม,กาแฟ,เอ,เปร,โซ่,เข้มข้น,ชอบ,ขม,ลอง,ยังมี,สิบ,รส,สับเปลี่ยน,เลือก,ซ้ำ,เครื่องดื่ม,กาแฟ,แก้ว,โมจิ,โต้,มะนาว,ปั่น,ใส่,มิ้นท์,สต,อร,์เบอร,รี่,ปั่น,เปรียว,ของกิน,เล่น,หนัก,ยำ,องุ่น,หมู,ย่าง,สลัด,สปา,เก,ตตี้,หลายอย่าง,ราคา,ไอศครีม,สกู๊ป,49,บาท,อาหาร,จาน,120,200,บาท,โดยประมาณ,เบื่อ,ไอศครีม,เดิม,ห้าง,ลอง,ชิม,ดู,แล้,วจะ,ติดใจ,ชอบ"
149,150,"จอดรถริมถนนหน้าร้าน ไม่ต้องกังวลที่เหลือเฟือเพราะเป็นถนนซอย 

อาหารจานเด่นจะเป็นสปาเกตตี ลองมาหลายจานก็อร่อยทั้นั้น เส้น al dante พอดี รสเข้มข้น คาโบนารา ผัดพริกกระเทียม อร่อยหมด ข้าวจานเดียวก็ใช้ได้แต่ไม่เด่นเท่าเส้นราคาก็จะไม่ถึงร้อย แต่พาสต้าจะร้อยขึ้นไปจนสองร้อยกว่า ปีกไก่ทอดสั่งมากินแล้วห่อเหี่ยวมาก ก็แห้งอร่อยใช้ได้แต่จานนึงมีปีกกลางผ่าครึ่งอยู่ 5 ชิ้น! ขายจานละ 60 จานที่ใส่มาว่าเล็กแล้วยังดูโหรงเหรงเลย ขายแพงขึ้นแต่ปริมาณเหมาะกับหนึ่งจานจะดูดีกว่านี้ คราวหลังเจออย่างนี้จะถ่ายรูปเอาไว้

เค้กก็อร่อยดีแต่ค่อนข้างแพง ชี้นละเกือบร้อยถึงร้อยกว่าๆ ทีเด็ดอยู่ที่พวกเครปชอบมากกว่า เบาๆดี  เครปซอสส้ม เครปไส้กล้วยราดช็อก อร่อย

กาแฟเป็นส่วนที่น่าผิดหวัง เพราะขึ้นชื่อว่าร้านกาแฟแต่กาแฟไม่อร่อย ลาตเต้ร้อนไม่ร้อนเลยสงสัยสตีมนมไม่ได้ที่ ลาตเต้อาร์ตก็ออกมาน่าเกลียดขนาดไม่มียังดีกว่า ไม่ได้เข้าไปมองว่าใช้เครื่องยี่ห้ออะไร 

สถานที่เป็นบ้านที่ดัดแปลงเป็นร้าน จะคับแคบหน่อย มีไม่กี่โต๊ะ ตกแต่งบรรยากาศน่ารักดี แอร์ไม่เย็น ถ้าโต๊ะเต็มต้องไปนั่งโต๊ะเสริมอีกห้องนึงซึ่งโต๊ะ เก้าอี้ บรรยากาศแย่กว่ากันมากๆ

สรุปอาหารอร่อยแต่ราคาแพงยังกะอยู่ในห้าง ร้านอยู่ในซอยลึกราคาน่าจะเป็นมิตรกว่านี้ แต่ราคานี้คนก็เข้าร้านไม่ขาดสายอยู่แล้ว รถจอดหน้าร้านเต็มตลอด. ","จอด,รถ,ริมถนน,หน้า,ไม่ต้อง,กังวล,เหลือเฟือ,ถนน,ซอย,อาหาร,จาน,เด่น,สปาเกตตี,ลอง,จาน,อร่อย,ทั้นั้น,เส้น,al,dante,รส,เข้มข้น,คา,โบ,นารา,ผัด,พริก,กระเทียม,อร่อย,ข้าว,จาน,ใช้ได้,เด่น,เส้น,ราคา,ร้อย,พาสต้า,ร้อย,ขึ้นไป,สอง,ร้อย,ปีก,ไก่ทอด,สั่ง,กิน,ห่อเหี่ยว,แห้ง,อร่อย,ใช้ได้,จาน,นึง,ปีก,กลาง,ผ่า,ครึ่ง,ชิ้น,ขาย,จาน,60,จาน,ใส่,ดู,โหรงเหรง,ขาย,แพง,ปริมาณ,เหมาะกับ,จาน,ดู,ดีกว่า,เจอ,ถ่ายรูป,เอาไว้,เค้ก,อร่อย,ดีแต่,แพง,ชี้,ร้อย,ร้อย,ทีเด็ด,เครป,ชอบ,เบา,ดี,เครป,ซอส,ส้ม,เครป,ไส้,กล้วย,ราด,ช็อก,อร่อย,กาแฟ,ผิดหวัง,ขึ้นชื่อว่า,กาแฟ,กาแฟ,อร่อย,ลา,ตเต้,ร้อน,ร้อน,สงสัย,สตีม,นม,ลา,ตเต้,อาร์ต,ออกมา,น่าเกลียด,ขนาด,ดีกว่า,เข้าไป,เครื่อง,ยี่ห้อ,สถานที่,บ้าน,ดัดแปลง,คับแคบ,กี่,โต๊ะ,ตกแต่ง,บรรยากาศ,น่ารัก,ดี,แอร์,เย็น,โต๊ะ,เต็ม,นั่ง,โต๊ะ,เสริม,ห้อง,นึง,โต๊ะ,เก้าอี้,บรรยากาศ,แย่,สรุป,อาหาร,อร่อย,ราคาแพง,ยังกะ,ห้าง,ซอย,ลึก,ราคา,เป็นมิตร,ราคา,คน,ไม่ขาดสาย,อยู่แล้ว,รถ,จอด,หน้า,เต็ม"
150,151,"เป็นร้านแรกที่รู้จักว่ามีเครื่องดื่มนี้ด้วย

ชาเขียวร็อคซอลท์ชีส Green tea rock salt cheese ⭐⭐⭐⭐1/2

เคยทานเมนูอื่นก็ไม่ถูกใจเท่านี้ 

เมนูที่เคยทานเช่น ชานมไข่มุก โกโก้ร็อคซอลท์ชีส 

แต่เมนูนี้ไม่ใช่สำหรับทุกคนนะคะ เราลองชวนให้คนอื่นทาน แต่ละคนทำหน้าแปลก ๆ ทั้งนั้นเลย 555 

งงว่าเราชอบอยู่คนเดียวเหรอ แต่มันเป็นเมนูแนะนำอันดับ 1 ของร้านนะ ???? แปลว่าต้องมีคนชอบเหมือนเราเยอะสิ","รู้จัก,เครื่องดื่ม,ชาเขียว,ร็อค,ซอล,ท์,ชีส,Green,tea,rock,salt,cheese,⭐⭐⭐⭐,ทาน,เมนู,ถูกใจ,เมนู,ทาน,ชา,นม,ไข่มุก,โกโก้,ร็อค,ซอล,ท์,ชีส,เมนู,สำหรับ,นะคะ,ลอง,ชวน,คนอื่น,ทาน,แต่ละคน,ทำ,หน้า,แปลก,555,งง,ชอบ,คนเดียว,เหรอ,เมนู,แนะนำ,อันดับ,แปล,คน,ชอบ,เหมือน,สิ"
151,152,เขาเล่าว่า ร้านนี้ถือว่าเป็น คาเฟ่ ร้านแรกของประเทศ รัชกาลที่หก ท่านให้เปิด ( ในยุคคนี้ถือว่า เปิดใหม่อีกครั้ง เพราะปิดไปแล้วทีหนึ่ง ) ขนมเค้กเราว่าอร่อยดี และกาแฟราคาไม่แพงเลย - ลาเต้ปั่น 50 บาท แต่เหนือสิ่งอื่นใด เราว่าบรรยากาศดี ชอบไม่ชอบก็ควรแวะมาเยือนสักครั้ง,"เล่า,คาเฟ่,ประเทศ,รัชกาล,ที่หก,ท่าน,ยุ,คค,อีกครั้ง,ขนมเค้ก,อร่อย,ดี,กาแฟ,ราคา,แพง,ลาเต้,ปั่น,50,บาท,เหนือสิ่งอื่นใด,บรรยากาศ,ดี,ชอบ,ชอบ,แวะ,เยือน,สักครั้ง"
152,153,"เป็นร้านที่แวะเติมความหวานบ่อยมาก
>>Location
ร้านตั้งอยู่ภายในบริเวณทางด่วนตรงด่านพระรามเก้าขาเข้ากรุงเทพฯ (ด่าน 25 บาท) มีร้านซาลาเปาวราภรณ์อยู่ข้างๆกัน

>>ด้านใน
ร้านจะแนวกระทัดรัดเพราะลูกค้าก็เป็นลูกค้าใช้บริการทางด่วนมักจะซื้อไปทานบนรถ

>>เมนูของร้าน
เป็นจำพวก นม ชา กาแฟ ขนม และ เค็ก ที่เป็นแนวเล็กๆน้อยๆ ประทังหิวได้

>>เมนูที่สั่ง
นมสดปั่น 70 บาท - ส่วนตัวว่าราคาแพงไปนิด แต่สุดท้ายก็ยังซื้ออยู่ดี ส่วนรสชาติก็โอเค เป็นนมรสหวานและมีความมันผสมอยู่ด้วย (แอบคิดว่าเขาผสมวิปครีมด้วยรึบ่าวนะ)

>>การบริการ
ทั่วไป แต่ที่เป็นจุดเด่นคงเป็นการที่สามารถโทรสั่งก่อนล่วงหน้าได้ ก่อนที่เราจะขับรถเข้าด่าน จะได้ไม่ต้องรอ

>>สรุป
เป็นการอำนวยความสะดวกอย่างมากที่มีร้านขายน้ำอยู่ในด่านเก็บตังค์ค่าทางด่วน รสชาติก็ดีใช้ได้","แวะ,เติม,ความหวาน,Location,ตั้งอยู่,บริเวณ,ทางด่วน,ด่าน,พระรามเก้า,ขาเข้า,กรุงเทพฯ,ด่าน,25,บาท,ซาลาเปา,รา,ภร,ณ์,ด้านใน,แนว,กระทัดรัด,ลูกค้า,ลูกค้า,บริการ,ทางด่วน,ซื้อ,ทานบน,รถ,เมนู,นม,ชา,กาแฟ,ขนม,เค้ก,เป็นแนว,ประทัง,หิว,เมนู,สั่ง,นมสด,ปั่น,70,บาท,ส่วนตัว,ราคาแพง,สุดท้าย,ซื้อ,อยู่ดี,รสชาติ,โอเค,นม,รส,หวาน,ความมัน,ผสม,แอบ,ผสม,วิป,ครีม,บ่าว,บริการ,ทั่วไป,จุดเด่น,โทร,สั่ง,ล่วงหน้า,ก่อนที่,ขับรถ,ด่าน,ไม่ต้อง,รอ,สรุป,การอำนวยความสะดวก,ขาย,น้ำ,ด่าน,ตังค์,ค่า,ทางด่วน,รสชาติ,ใช้ได้"
153,154,"เรื่องขนม ไม่ค่อยสันทัด ดังนั้นขอreviewเฉพาะเรื่องกาแฟร้อนครับ 
1. Tampแน่นมากเกินไป โถมย้ำๆไปทั้งตัว2-3รอบ มันมีผลต่อช๊อตกาแฟนะครับ
2. พอtampแน่นมาก ซ๊อตก็เลยน้อยไป พี่เล่นรองน้ำร้อนมาเทเติมไปดื้อๆซะงัั้น แก้ที่tampตั้งแต่แรกดีกว่า
3. ตีนมเสดแล้วพอมาสปินแก้ ทำหกอีก - - (เจออีกแล้ว เอาช้อนตักฟองนมออกมาก่อน แล้วค่อยเทนม โปะข้างบนอีกที)
อันนี้ของCapนะครับ นอกนั้นถือว่าโอเคครับ 

สำหรับร้านนี้แนะนำMochaมากกว่าครับ 
น่าจะถนัดกว่า","เรื่อง,ขนม,สันทัด,ดังนั้น,review,เฉพาะเรื่อง,กาแฟร้อน,Tamp,แน่น,มากเกินไป,โถม,ย้ำ,รอบ,มีผลต่อ,ช๊อต,กาแฟ,tamp,แน่น,ซ๊อต,พี่,เล่น,รอง,น้ำร้อน,เท,เติม,ดื้อ,งัั้น,แก้,tamp,ตั้งแต่แรก,ดีกว่า,ตี,นม,เสด,มาส,ปิน,แก้,ทำ,หก,เจอ,อีกแล้ว,ช้อน,ตัก,ฟอง,นม,ออกมา,เท,นม,โปะ,อีกที,อันนี้,Cap,โอเค,สำหรับ,แนะนำ,Mocha,ถนัด"
