,Review ID,Review,Review_tokenized
76,77,"มาถึงเมืองชลอีกครั้งค่า จาไปพัทยา แต่มอเตอร์เวย์รถติดในวันหยุดยาว เลยตัดสินใจเลี้ยวออกมาเมืองชล ผ่านตลาดชลคิดว่าต้องมีร้านอร่อยซ่อนตัวแน่กับเมืองดังภาคตะวันออก เลยขอตามรอยนักชิมในwongnai. คิดว่าร้านนี้แปลกฝุดๆ เลยขอลอง

มากับโชคจริงๆค่าวันนี้ มาไม่หลงเลยจ้า แถมมาตอนคนโล่งไม่แน่นต่างหาก ได้โต๊ะในร้านมีพัดลมเลยสบายๆค่ะ พอสั่งเสร็จ อุต๊ะคนมาแยะเลยสั่งนั่งทานและสั่งกลับ แต่เจ้าของร้านและพนักงานต้อนรับดีค่ะ บรรยายกาศบ้านๆแบบนี้  ชิวๆเอาไปสองดาวครึ่ง ถ้ารักบรรยายกาศเก่าๆเอาไป3.5ดาวจ้า

ลองสั่งเลยจ้ากับเมนูนอกแนวนิดๆนะ แต่ไม่แหวก เพราะโอกาสกลับมาทานอีกคงจะยากหน่อย อยากเก็บความทรงจำดีๆ เริ่มจาก

ข้าราดกระเพราะปูส์และกั้งส์  ใส่ ""ส์"" ให้เพราะแยะจ้า รสชาติอเคเลย จัดจ้านเผ็ดร้อน ปูมาแยะเป็นเนื้อกรรเชียงเล็กๆ มาแยะเชียวค่า กั้งตัวเขื่องเรียงมาสองตัวจ้า เนื้อแน่นหนา. สมราคา150บาท สี่ดาวค่า

อีกจานเป็นข้าวหมูกระเทียมหมูสามชั้รทอดมาเต็มจานรสชาติดีค่ะหวานเค็มพอดีเข้ากับกระเทียมหอม เสริฟบนข้าวร้อนๆ ฟินค่ะ สี่เาวได้ค่า ถ้าไม่ชอบเผ็ด กับราคา50บาท

น้ำชามะลิหอมๆฟรีจ้า แถมด้วยต้นหอมให้มาทีเป็นกอง แก้เผ็ดแก้เลี่ยนดีค่ะ ไม่ผิดหวังสมราคาคุยจิงๆดิส์ส์ส์

แอบดูข้าวกระเพราหมึกแต่ไม่ได้ลองค่า เล่นให้หมึกชิ้นเบ้งแบบหมึกย่างไม้โตๆเต็มจานมองไม่เห็นข้าวเลย เสียดายไกลไปหน่อย ไม่งั้นมาประจำแน่ค่า
","มาถึง,เมือง,ชล,อีกครั้ง,ค่า,จา,พัทยา,มอเตอร์เวย์,รถติด,วันหยุด,ตัดสินใจ,เลี้ยว,ออกมา,เมือง,ชล,ตลาด,ชล,อร่อย,ซ่อนตัว,แน่,เมือง,ตะวันออก,ตามรอย,ชิม,wongnai,แปลก,ฝุด,ลอง,โชค,ค่า,หลง,แถม,ตอน,คน,โล่ง,แน่น,โต๊ะ,พัดลม,สั่ง,อุ,ต๊ะคน,สั่ง,นั่ง,ทาน,สั่ง,เจ้าของ,พนักงานต้อนรับ,ดี,บรรยาย,กา,บ้าน,แบบนี้,ชิว,สอง,ดาว,ครึ่ง,รัก,บรรยาย,กา,เก่า,35,ดาว,ลอง,สั่ง,เมนู,แนว,แหวก,โอกาส,กลับมา,ทาน,ความทรงจำ,ดี,ราด,กระ,ปู,ส์,กั้ง,ส์,ใส่,ส์,รสชาติ,เค,จัดจ้าน,เผ็ดร้อน,ปู,เนื้อ,กรรเชียง,เชียว,ค่า,กั้ง,ตัว,เขื่อง,เรียง,สอง,ตัว,เนื้อ,แน่นหนา,สมราคา,150,บาท,สี่,ดาว,ค่า,จาน,ข้าว,หมู,กระเทียม,หมู,สาม,ชั้ร,ทอด,เต็ม,จาน,รสชาติ,ดี,หวาน,เค็ม,เข้ากับ,กระเทียมหอม,เส,ริ,ฟบน,ข้าว,ร้อน,ชอบ,สี่,เาว,ค่า,ชอบ,เผ็ด,ราคา,50,บาท,น้ำ,ชามะลิ,หอม,ฟรี,แถม,ต้น,หอม,เป็นกอง,แก้เผ็ด,แก้,เลี่ยน,ดี,ผิดหวัง,สม,ราคาคุย,ดิส,์ส์ส์,แอบดู,ข้าว,กระ,เพรา,หมึก,ลอง,ค่า,เล่น,หมึก,ชิ้น,เบ้,หมึก,ย่าง,ไม้,เต็ม,จาน,มองไม่เห็น,ข้าว,เสียดาย,ไม่งั้น,ประจำ,แน่,ค่า"
77,78,"ร้านจะเป็นร้านนั่งแทบจะติดทะเลเลยนะคะ อารมณ์ชาวบ้านนิดๆ แต่คนเยอะประสาร้านดัง

อาหารราคาไม่แพงนะคะ กลุ่มเรากินกันเพียบก็ตกหัวละสองร้อยนิดๆได้ สั่งมามีปลาหมึกกระเทียม หอยหวาน ตำทะเล อื่นๆ อร่อยทุกอย่าง ถึงพวกส้มตำกับต้มยำจะติดหวานอยู่ (ถ้าใครไม่กินหวาน ควรจะต้องบอกไว้นะคะ)

สำหรับร้านที่ดังและคนเยอะ ถือว่าอาหารไม่ช้าค่ะ (มีลืมอยู่เมนูหนึ่ง แต่พอตามไป ไม่ทันไรก็มาค่ะ)","นั่ง,แทบจะ,ติด,ทะเล,นะคะ,อารมณ์,ชาวบ้าน,คน,ประสา,อาหาร,ราคา,แพง,นะคะ,กินกัน,เพียบ,ตก,หัว,สอง,ร้อย,สั่ง,ปลาหมึก,กระเทียม,หอย,หวาน,ตำ,ทะเล,อร่อย,ส้มตำ,ต้มยำ,ติด,หวาน,กิน,หวาน,ควรจะ,นะคะ,สำหรับ,คน,อาหาร,ลืม,เมนู"
78,79,"มีโอกาสได้ไปกินไอติมที่ร้านนี้มา ชอบตั้งแต่การตกแต่งร้านเลย มันทั้งแนวและน่ารักในเวลาเดียวกัน เป็นร้านเล็กๆ อบอุ่น ได้เจอเจ้าของร้านด้วย เจ้าของร้านเป็นสาวหวานกับสาวติสต์ เลยทำให้ได้คำตอบว่าทำไมร้านถึงออกมาได้แนวขนาดนี้ แม้แต่ไอศครีมก็แนว เมนูที่ได้ทานมีอยู่ 6 อย่างด้วยกัน

อย่างแรกเป็นไอศกรีมเมลอนญี่ปุ่น ที่เจ้าของเค้าสร้างสรรค์มาอย่างใส่ใจด้วยการนำเมลอนสดๆ มาแช่แข็งแล้วปั่น ดังนั้นรสชาติจะเป็นเมลอนแท้ๆ เลย หอมหวาน อร่อยมาก

อย่างที่สองคือ Brownie Ice cream sandwich เป็นบราวนี่แบบนิ่ม กินกับไอติมหวานๆ ออกแนวกินเพลินๆ ค่ะ

ต่อมาเป็น Banoffee ice cream pie อันนี้ค่อนข้างปลื้มเช่นกันถึงแม้จะเป็นคนไม่กินกาแฟ แต่รสชาติที่เค้าทำมาจัดว่ากลมกล่อม กินแล้วละมุนดีค่ะ โดยเฉพาะเมื่อกินกับกล้วยที่อยู่ด้านบน กินแล้วอยากกินอีกรู้สึกว่าไม่พอค่ะ อิอิ

ถัดมาเป็น rocky road ice cream pie รสชาติถือว่าดีนะคะ มีมาชเมลโลตามสไตล์ Rocky road มีความขมเล็กๆ อยู่ในนั้น ไม่แน่ใจว่าเป็น Dark Choc หรืออะไรสักอย่าง ซึ่งแบลชอบค่ะ^^

เมนูที่ห้าเป็น Semi freddo อันนี้แปลกหน่อย ถ้าใครชอบก็ชอบเลย ใครไม่ชอบอาจจะรู้สึกแปลกๆ แต่ที่เด่นมากคือเรื่องความหอมของเปลือกส้มที่ใช้โรยมาด้านบน มันหอมมากแต่ก็ขมเฝื่อนๆ หน่อยๆ ตัวไอศครีมเป็นสไตล์เกร็ดน้ำแข็งเย็นๆ ชื่นใจ รสชาติไม่เด่นนัก ไม่แน่ใจว่าอาจจะโดนเปลือกส้มกลบไปหรือเปล่า

สุดท้ายของวันนี้เป็น Layered ice pop อันนี้น่ารักดี เค้าใส่ถ้วยเล็กๆ มาให้ ดึงออกมาก็ได้ไอติมแท่งกลมๆ มาแท่งหนึ่ง มีหลายสีหลายชั้น แต่ละชั้นก็เป็นคนละรสชาติกัน วันนั้นที่ได้กินเป็น สตอเบอรี่ ส้มแล้วก็ครีม เค้าบอกว่ามันจะเปลี่ยนไปเรื่อยๆ บางวันก็มีกีวีด้วย

ที่จริงยังมีอีกหลายเมนูมากๆ หน้าตาน่ากินทุกเมนู แต่แค่นี้ก็เยอะมากแล้ว เอาไว้วันหลังไปกินมาอีกจะบอกเพิ่มนะคะ ร้านนี้อยู่ที่ Rain hill ตรงสุขุมวิท 47 หาไม่ยากค่ะ ขึ้นมาชั้นสองไม่ว่าจะออกจากลิฟท์หรือขึ้นบันไดเลื่อนก็เลี้ยวไปทางขวานะคะ ร้านกระจกสีเหลืองๆ เหมือนในรูปน่ะค่ะ สนนราคาก็ไม่แพงเลยค่ะ สำหรับไอศครีมที่ใส่ความตั้งใจและแนวคิดเก๋ๆ แบบนี้ ที่สำคัญอร่อยด้วย แต่ละเมนูอยู่ราวๆ 100 กว่าบาทหรือน้อยกว่าค่ะ ลองหาโอกาสไปลองกันนะคะ ","มีโอกาส,กิน,ไอติม,ชอบ,ตกแต่ง,แนว,น่ารัก,ในเวลาเดียวกัน,อบอุ่น,เจอ,เจ้าของ,เจ้าของ,เป็นสาว,หวาน,สาว,ติ,สต,ทำ,ให้ได้,คำตอบ,ออกมา,แนว,ขนาด,ไอศครีม,แนว,เมนู,ทาน,ไอศกรีม,เม,ลอน,ญี่ปุ่น,เจ้าของ,เค้า,สร้างสรรค์,ใส่ใจ,การนำ,เม,ลอน,สด,แช่แข็ง,ปั่น,ดังนั้น,รสชาติ,เม,ลอน,หอม,หวาน,อร่อย,ที่สอง,Brownie,Ice,cream,sandwich,บรา,นิ่ม,กิน,ไอติม,หวาน,แนว,กิน,เพลิน,ต่อมา,Banoffee,ice,cream,pie,อันนี้,ปลื้ม,คน,กิน,กาแฟ,รสชาติ,เค้า,ทำ,กลมกล่อม,กิน,ละมุน,ดี,โดยเฉพาะ,กิน,กล้วย,ที่อยู่,ด้านบน,กิน,กิน,รู้สึก,อิอิ,ถัดมา,rocky,road,ice,cream,pie,รสชาติ,ดี,นะคะ,เมล,โล,สไตล์,Rocky,road,ความขม,แน่ใจ,Dark,Choc,สัก,แบ,ชอบ,ชอบ,เมนู,ห้า,Semi,freddo,อันนี้,แปลก,ชอบ,ชอบ,ชอบ,รู้สึก,แปลก,เด่น,เรื่อง,หอม,เปลือก,ส้ม,โรย,ด้านบน,หอ,มมาก,ขม,เฝื่อน,ตัว,ไอศครีม,สไตล์,เกร็ด,น้ำแข็ง,เย็น,ชื่นใจ,รสชาติ,เด่น,แน่ใจ,โดน,เปลือก,ส้ม,กลบ,สุดท้าย,Layered,ice,pop,อันนี้,น่ารัก,ดี,เค้า,ใส่,ถ้วย,ดึง,ออกมา,ไอติม,แท่ง,กลม,แท่ง,สี,ชั้น,ชั้น,คนละ,รสชาติ,กิน,สตอ,เบอ,รี่,ส้ม,แล้วก็,ครีม,เค้า,บอ,เปลี่ยนไป,กีวี,ยังมี,เมนู,หน้าตา,น่ากิน,เมนู,เอาไว้,วันหลัง,กิน,นะคะ,Rain,hill,สุขุมวิท,47,หาไม่,ชั้นสอง,ออกจาก,ลิฟท์,บันไดเลื่อน,เลี้ยว,ทางขวา,นะคะ,กระจก,สีเหลือง,เหมือน,รูป,สนนราคา,แพง,สำหรับ,ไอศครีม,ใส่,ความตั้งใจ,แนวคิด,เก๋,แบบนี้,อร่อย,เมนู,ราว,100,บาท,ลอง,หา,โอกาส,ลอง,นะคะ"
79,80,"มาคนเดียว เดินเลือกอยู่นาน อยากกินอะไรที่ไม่อ้วน ไม่ต้องต่อคิว นั่งได้เรื่อยๆ ไม่ต้องรีบ(เพราะจำกัดเวลาหรือเกรงใจคนอื่นรอโต๊ะ) เลยได้ร้านดั้งเดิม เสมือนเป็นวัยรุ่นมาด้วยกัน555

@สั่งกินเล่น ส้มตำข้าวโพด รสชาติดีแต่ออกหวาน และไม่เผ็ดเลย แอบเสียใจเพราะชอบเปรี้ยว กินกับข้าวเหนียวอุ่นๆ ส้มตำทอดเยอะอ่ะหวานเช่นกัน 

@ชอบบรรยากาศที่ไม่รีบมาก โต๊ะข้างๆมาเลี้ยงรุ่นคนเยอะมาก+มีลูกเล็กมาด้วย ก็สามารถนั่งคุยได้นานเลย ผู้จัดการร้านเข้ามาเทคแคร์ต่อโต๊ะเพิ่มให้เรื่อยๆตามคนที่มาเพิ่ม 

@ถ้าต้องการอะไรง่ายๆ ไวๆ ราคาเป็นมิตร นั่งได้นาน เมนูไม่ต้องคิดมาก ละก้อ อย่าลืมร้านนี้เลยค่ะ","คนเดียว,เดิน,เลือก,กิน,อ้วน,ไม่ต้อง,คิว,นั่ง,ไม่ต้อง,รีบ,จำกัด,เวลา,เกรงใจ,คนอื่น,รอ,โต๊ะ,ดั้งเดิม,เสมือน,วัยรุ่น,555,สั่ง,กิน,เล่น,ส้มตำ,ข้าวโพด,รสชาติ,ดีแต่,หวาน,เผ็ด,แอบ,เสียใจ,ชอบ,เปรี้ยว,กิน,ข้าวเหนียว,อุ่น,ส้มตำ,ทอด,อ่ะ,หวาน,ชอบ,บรรยากาศ,รีบ,โต๊ะ,เลี้ยง,รุ่น,คน,มีลูก,นั่ง,คุย,ผู้จัดการ,เข้ามา,เทคแคร์,โต๊ะ,คน,ที่มา,ต้องการ,ไว,ราคา,เป็นมิตร,นั่ง,เมนู,ไม่ต้อง,คิดมาก,อย่า,ลืม"
80,81,ชอบพาย ต้องร้านนี้  มีพายหลากหลายแบบและรสชาติ เค๊กก็มีครับ ต้องมาลองชมและชิมครับ ที่แนะนำคือพายมะพร้าว หน้าพายเฉยๆนะครับแต่ไส้หรือเนื้ออร่อยดีครับ  ที่ร้านมีกาแฟสดด้วยแต่ไม่ได้สั่ง เพราะต้องไปอีกหลายร้าน 555,"ชอบ,พาย,พาย,หลากหลาย,รสชาติ,เค๊ก,ลอง,ชม,ชิม,แนะนำ,พาย,มะพร้าว,หน้า,พาย,ไส้,เนื้อ,อร่อย,ดี,กาแฟสด,สั่ง,555"
81,82,เป็นร้านอาหารเช้า มีโจ๊กหมู หมี่ซั่ว เกาเหลาเลือดหมู ติ่มซำ ปาท่องโก๋ ชา-กาแฟ พอลองท้องได้ หากจะหาอะไรทานช่วงเช้าถ้าพักแถวอ่าวนาง ขับรถออกมาไม่นานไม่ต้องขับถึงตัวเมืองกระบี่ อยู่ใกล้ปั๊ม ปตท. ใกล้ๆกัน มีร้านแม่แววขนมจีน กับแม่พรไก่ทอดข้าวหมกไก่ ด้วย,"อาหารเช้า,โจ๊ก,หมู,หมี่,ซั่ว,เกาเหลา,เลือดหมู,ติ่มซำ,ปาท่องโก๋,ชา,กาแฟ,ลอง,ท้อง,หา,ทาน,เช้า,พัก,แถว,อ่าว,ขับรถ,ออกมา,ไม่ต้อง,ขับ,ตัวเมือง,กระบี่,ปั๊ม,ปตท,แม่,แวว,ขนมจีน,แม่,พร,ไก่ทอด,ข้าวหมก,ไก่"
82,83,"ที่บอกว่าขอลบดาวออก 1 ดวง เพราะว่าคราวก่อนเคยมาทานที่ร้านนี้แต่อีกสาขานึงที่อยู่ตรงตลาดหลังการบินไทย 
(ลองย้อนกลับไปดูรีวิวเก่าๆได้) รู้สึกว่ามันดีกว่านี้อ่า หรือว่าวันนั้นที่เราไปทานดาราเค้าอยู่ร้านเลยดีกว่าหว่า? 

คือ ช่วงวันหยุดที่ผ่านมาโดนลากออกมาห้างนี้ เพราะว่าเพื่อนอยากจะมาดูอะไรแปลก แนวๆ และเบื่อห้างธรรมดาทั่วไปแล้ว5555 
แล้วคือแบบเกิดอาการหิวนะ เลยอยากนั่งหาอะไรทานกันเบาๆ ก็เอ่อ..ส้มตำแล้วกันนะ เบาดีๆ 

ร้านนี้เพิ่งเปิดใหม่ที่สาขานี้ ไม่แน่ใจว่านานรึยังนะคะ 
คือร้านก็โล่ง ดูสะอาดตาดี เข้าไปเมนูที่สั่งมี ""ส้มตำมั่ว"" อันนี้เพื่อนทานบอกว่า รสแซ่บดีอร่อย แต่ตาลว่าเส้นขนมจีนมันเยอะไปหน่อย
ดูอืดๆ ยังไงชอบกล ทานไป 2 คำ รสชาติโอเคค่ะ แซ่บดีนะ

""น้ำตกหมู"" อันนี้ไม่ได้ทาน บอกไม่ได้เรื่องรสชาติ แต่บอกได้เรื่องหน้าตา หน้าตาดูดีนะคะ แต่ให้น้อยมาก 80 บาท ให้มาเหมือน 40 บาท
เบาบางมาก มีหมูอยู่ไม่กี่ชิ้นเอง

""ยำมาม่า"" อันนี้ได้ทานไป 2 คำ เส้นนุ่มหนึบมากเลย ชอบนะ รสชาติดี แต่เครื่องยังไม่ถึงเท่าไหร่เลยทำให้เฉยๆ 

ราคาออกมา 300+ (น้ำเปล่า 2 ขวด ) คือส่วนตัวคิดว่า รสชาติเค้าดีนะ โอเคเลย 
พนักงานบริการดี เรียกง่ายไม่เล่นตัว แต่เรื่องราคา + ปริมาณ นี้เทียบแล้วก็แพงอยู่นะ เออ","บอ,ลบ,ดาว,ดวง,ทาน,สาขา,นึง,ที่อยู่,ตลาด,บิน,ไทย,ลอง,ย้อนกลับ,ไปดู,รีวิว,เก่า,รู้สึก,ดีกว่า,อ่า,หรือว่า,ทาน,ดารา,เค้า,ดีกว่า,หว่า,วันหยุด,ที่ผ่านมา,โดน,ลาก,ออกมา,ห้าง,เพื่อน,ดู,แปลก,แนว,เบื่อ,ห้าง,ธรรมดา,ทั่วไป,5555,อาการ,หิว,นั่ง,หา,ทาน,เบา,เอ่อ,ส้มตำ,เบา,ดี,สาขา,แน่ใจ,นะคะ,โล่ง,ดู,สะอาด,ตา,ดี,เข้าไป,เมนู,สั่ง,ส้มตำ,มั่ว,อันนี้,เพื่อน,ทาน,บอ,รส,แซ่,บดี,อร่อย,ตาล,เส้น,ขนมจีน,ดู,อืด,ชอบกล,ทาน,รสชาติ,โอเค,แซ่,บดี,น้ำตก,หมู,อันนี้,ทาน,ไม่ได้เรื่อง,รสชาติ,ได้เรื่อง,หน้าตา,หน้าตา,ดูดี,นะคะ,80,บาท,เหมือน,40,บาท,เบาบาง,หมู,กี่,ชิ้น,ยำ,มาม่า,อันนี้,ทาน,เส้น,นุ่ม,หนึบ,ชอบ,รสชาติ,ดี,เครื่อง,ราคา,ออกมา,300,น้ำเปล่า,ขวด,ส่วนตัว,รสชาติ,เค้า,ดี,โอเค,พนักงานบริการ,ดี,เล่นตัว,เรื่อง,ราคา,ปริมาณ,เทียบ,แล้วก็,แพง,เออ"
