,Review ID,Review,Review_tokenized
220,221,"เนื่องด้วยวันนี้ไปเดินเล่นมาเดินไปเดินมาก็บ่ายสองเข้าไปแล้ว เดินผ่านชั้น G พอดี เลยแวะเข้าทานอาหารที่ร้าน ZEN 

ไม่ได้เข้ามานานสำหรับร้านอาหารญี่ปุ่น ZEN ร้านนี้เข้าไปในร้าน คนค่อนข้างน้อยแล้ว เพราะไม่ใช่ช่วงพักเที่ยง พนักงานดูเหนื่อยๆ สั่งเซ็ตอาหารที่ชื่นชอบและเป็นเมนูยอดนิยมมาทาน คือเซ็ทปลาแซลมอนย่างซีอิ้ว ราคาขึ้นแล้วนะ เป็นเซ็ทละ 270 บาทแล้ว และถ้าสั่งเป็นเซ็ท จะได้ชามะนาวหรือชาเย็น และ ของหวาน พานาคอตต้า แถมมาด้วยตอนคิดเงิน ด้วยความที่หิวมาก หมดภายในพริบตาเลย  555 รสชาติยังคงความอร่อยเหมือนเดิมค่ะ คุณภาพเนื้อปลา เครื่องเคียง ก็อร่อย เสียแต่เรื่องพนักงานนิดหน่อย อยู่ไกลมาก เรียกหลายครั้งกว่าจะมาถึงโต๊ะ แต่บรรยากาศร้านก็ดีค่ะ  ","เนื่องด้วย,เดินเล่น,เดินไปเดินมา,บ่าย,สอง,เข้าไป,เดินผ่าน,ชั้น,แวะ,ทานอาหาร,ZEN,เข้ามา,สำหรับ,อาหาร,ญี่ปุ่น,ZEN,เข้าไป,คน,ข้างน้อย,พักเที่ยง,พนักงาน,ดู,เหนื่อย,สั่ง,เซ็ต,อาหาร,ชื่นชอบ,เมนู,ยอดนิยม,ทาน,เซ็ท,ปลา,แซลมอน,ย่าง,ซีอิ้ว,ราคา,เซ็ท,270,บาท,สั่ง,เซ็ท,ชา,มะนาว,ชาเย็น,ของหวาน,นา,คอ,ตต้า,แถม,ตอน,คิดเงิน,หิว,พริบตา,555,รสชาติ,อร่อย,เหมือนเดิม,คุณภาพ,เนื้อ,ปลา,เครื่องเคียง,อร่อย,เสียแต่,เรื่อง,พนักงาน,หลายครั้ง,มาถึง,โต๊ะ,บรรยากาศ"
221,222,"เว้นว่างในการ รีวิว มาพักนึงแล้ว วันนี้เแาซะหน่อย เริ่มด้วยร้านนี้ก่อนเลย จ่ายัน 2 
บรรยากาศ 4
รสชาติ 4
บริการ 3
ความสะอาด 3
สถานที่จอดรถ 3
สรุกว่า โอเคนะึะ ที่จอดรถไกลไปนิดเดิน เมื่อยเหมือนกัน ที่นี่ไม่ขายเหล้า อยากดื่มต้องซื้อมาเองนะคะ รสชาติอาหารกลาง ๆ ะ","เว้น,ว่าง,รีวิว,พัก,นึง,เแา,จ่า,ยัน,บรรยากาศ,รสชาติ,บริการ,ความสะอาด,สถานที่จอดรถ,สรุก,โอเค,ึะ,ที่จอดรถ,เดิน,เมื่อย,เหมือนกัน,ที่นี่,ขาย,เหล้า,ดื่ม,ซื้อ,นะคะ,รสชาติ,อาหาร,กลาง"
222,223,"เพิ่งสังเกตเห็นว่า toast box แอบมาเปิดร้านที่ central พระราม 2 ข้างๆ Bread Talk ตรงข้าม Pizza Hut ร้านสีขาวซ่อนตัวอยู่ในหลืบ กิ๊บเก๋ดูเป็นผู้ดีอังกฤษ แต่เสิร์ฟชากาแฟแบบจีนเจ๊ก ถือเป็นวัฒนธรรมร้านโกปี๊แบบอัพเกรด 

เมนูบนข้างฝา อั๊วอ่านไม่ค่อยรู้เรื่อง เลยถามพนักงานว่านอกจากเซ็ตเมนูแล้ว ของร่างที่คนชอบสั่งคืออะไร ก็เลยได้ ขนมปังปิ้งมาแผ่นนึงโรยหน้าสังขยาน้ำผึ้ง (Kaya) แผ่นละ 28 บาท เทียบกับเมนูของหวานประเภทเค้ก อันนี้นับว่าไม่แพง แต่ถ้าเทียบกับขนมปังแซนวิช กับขนมปังก้อนให้อาหารปลา ก็นับว่าแพงมาก ถือว่าเราไม่ได้จ่ายค่าขนมปัง แต่จ่ายให้ค่าแบรนด์ ค่าแอร์ โต๊ะเก้าอี้ และบรรยากาศเนาะ (บ่นทำไม จ่ายแพงกว่านี้ก็เจอมาแล้ว)

กวาดสายตาเล็งหาเครื่องดื่มไว้กลืนแก้ติดคอ ก็มั่วสั่งไปได้ ชาเย็นสูตรโบราณ เรียกเก๋ๆว่า Teh คนสั่งก็เต๊ะสมชื่อเหมือนกัน แก้วละ 45 บาท ก็นับว่าถูกกว่าสตาร์บัคส์งยู่หนึ่งเท่าตัว ใกล้เคียงกับชานมไข่มุก พอรับได้อยู่ แถมรสชาติดี ใม่หวานเลี่ยนเกิน

จริงๆที่ร้านมีเมนูข้าวประเภทข้าวหมูตุ๋น ข้าวแกงกะหรี่ด้วย วันนี้ยังไม่ได้สั่งทาน ใครเคยชิมแล้ว ช่วยคอมเมนต์กันหน่อย จะได้อิ่มอวบไปตามกัน ^ ^","สังเกตเห็น,toast,box,แอบ,central,พระราม,Bread,Talk,ตรงข้าม,Pizza,Hut,สี,ขาว,ซ่อนตัว,หลืบ,กิ๊บเก๋,ดู,ผู้ดี,อังกฤษ,เสิร์ฟ,ชา,กาแฟ,จีน,เจ๊ก,ถือเป็น,วัฒนธรรม,โก,ปี๊,อัพเกรด,เมนู,ฝา,อั๊ว,อ่าน,รู้เรื่อง,ถาม,พนักงาน,เซ็ต,เมนู,ร่าง,คน,ชอบ,สั่ง,ขนมปัง,ปิ้ง,แผ่น,นึง,โรยหน้า,สังขยา,น้ำผึ้ง,Kaya,แผ่น,28,บาท,เทียบ,เมนู,ของหวาน,ประเภท,เค้ก,อันนี้,นับว่า,แพง,เทียบ,ขนมปัง,แซ,วิ,ขนมปัง,ก้อน,ให้อาหาร,ปลา,นับว่า,แพง,จ่าย,ค่า,ขนมปัง,จ่าย,ค่า,แบรนด์,ค่า,แอร์,โต๊ะ,เก้าอี้,บรรยากาศ,เนาะ,บ่น,จ่าย,แพง,เจอ,กวาดสายตา,เล็ง,หา,เครื่องดื่ม,กลืน,แก้,ติดคอ,มั่ว,สั่ง,ชาเย็น,สูตร,โบราณ,เก๋,Teh,คน,สั่ง,เต๊ะ,สม,ชื่อ,เหมือนกัน,แก้ว,45,บาท,นับว่า,สตาร์บัคส์,ยู่,เท่าตัว,ใกล้เคียง,ชา,นม,ไข่มุก,รับได้,แถม,รสชาติ,ดี,ใม่,หวาน,เลี่ยน,เมนู,ข้าว,ประเภท,ข้าว,หมู,ตุ๋น,ข้าวแกง,กะหรี่,สั่ง,ทาน,ชิม,คอมเมนต์,อิ่ม,อวบ"
223,224,ร้านคาเฟ่ชิวๆร้านนี้ตั้งอยู่ที่ชั้น 1 ห้างมาบุญครองค่ะ มีเมนูกาแฟให้เลือกดื่มเยอะเลยค่ะ แบบมาตราฐานตามร้านกาแฟ กาแฟที่นี่จะเสริฟพร้อมช๊อคโกแล๊ตเล็กๆของร้านค่ะ กาแฟก็ใช้ได้ค่ะ ไม่ถึงกับอร่อยมากมาย สำหรับเบเกอรี่ก็เยอะค่ะ ทั้งเครปเค้ก ชีสเค้ก ค่ะ บรรยากาศ ชิวๆสบายๆ ที่นั่งสบายมากๆเลยค่ะ,"คาเฟ่,ชิว,ตั้งอยู่,ชั้น,ห้าง,บุญ,ครอง,เมนู,กาแฟ,เลือก,ดื่ม,มาตรา,ฐาน,กาแฟ,กาแฟ,ที่นี่,เส,ริ,ช๊อค,โก,แล๊ต,กาแฟ,ใช้ได้,ถึงกับ,อร่อย,สำหรับ,เบเกอรี่,เครป,เค้ก,ชีส,เค้ก,บรรยากาศ,ชิว,ที่นั่ง"
224,225,"วันนี้ไปทำบุญกับที่บ้าน อิ่มบุญกันไป 
หลังจากนั้น ก็หาอะไรให้อิ่มท้องกันดีกว่า :9


แถวนี้บรรยากาศดี ~
ร้านอาหารแถวนี้ติดริมน้ำอยู่หลายร้าน
ร้านนี้ ญาติจองเอาไว้ เพราะมีหลายคนรีวิวไว้ว่าอาหารอร่อย + บรรยากาศดี
ต้องมาลองซะละ >_<

เมนูที่นี่เป็นอาหารไทยที่ปนๆ อารมณ์ศิลปินนิดนึง
เพราะไม่ใช่ฟิวชั่นซะทีเดียว
อย่างผัดไทหมี่กรอบ หรือส้มตำมันแกว .... อื่นๆ
เป็นอาหารที่ประยุกต์ได้น่าสนใจ

ถ้าพูดถึงรสชาติ 
อย่างจานแรก ปีกไก่ทอดสมุนไพร
กรอบดีค่ะ เนื้อไก่ก็แน่น แต่แป้งแอบหนาด้วยเหมือนกัน
แต่ไม่อมน้ำมันนะคะ ญาติๆ ชอบค่ะ

หมูตุ๋นเห็ดหอม ก็เป็นอีกเมนูที่เห็นแล้ว
แอบตื่นเต้น เพราะตกแต่งจานสวยมากกกก น่าทาน
แต่จริงๆ ก็คือหมูตุ๋นผสมกับมันบด ทานกับผัดผัก
มันบดเนื้อละเอียดมาก ไม่เลี่ยน
ผสมกับเนื้อตุ๋นที่นุ่ม และเข้าเนื้อมาก

ปลากระพงทอดน้ำปลา
ที่นี่ ปลาเค้าหั่นเป็นชิ้นๆ ทานง่ายเลยค่ะ
น้ำราด ก็ออกหวานเค็มนิดๆ เปรี้ยวนิดหน่อย
แต่ญาติชอบมาก บอกว่าสู้แหลม.... ได้เลย

แกงเขียวหวานหมูย่าง อันนี่แอบแปลกใจ
เพราะเพิ่งเคยเห็นแกงเขียวหวานใส่ลำไย 0_o
แต่ชิมแล้ว รสชาติก็โอเค
คอหมูย่าง ชิ้นใหญ่ดีค่ะ :D

มาถึงจานที่ชอบเป็นพิเศษคือ ส้มตำมันแกว
ปกติเป็นคนไม่ชอบทานมันแกว
เพราะ มันจืด และน้ำเยอะไป (เป็นโรคกลัวน้ำ??? 5555)
แต่ต้องบอกว่าอันนี้ อร่อยกว่าจานต่างๆ ที่ผ่านมา
เพราะส่วนใหญ่อาหารจะเป็นทอดๆ ซะเยอะ
เลยเลี่ยนซะ T^T 
แต่ได้รสชาติเปรี้ยวอมหวานนิดๆ 
ตัดเลี่ยนได้เยอะเลยค่ะ :9

กับอีกจานที่ชอบคือ ยำวุ้นเส้น
รสชาติจัดได้อีกกกก ปลื้มมมมมม >3<
กุ้งก็มาตัวโตตตต เต็มคำ


ของคาวแล้วก็ ของหวาน อิ อิ
ที่นี่มีทั้งของลอยแก้ว และไอติม 
จริงๆ น่าจะมีอย่างอื่นอีก แต่ไม่ได้ดูเมนู
ที่สั่งกันไปก็ไอติมซะส่วนใหญ่ 
วันนี้อยากกินผลไม้นิดนึง ก็เลยสั่งมังคุดลอยแก้ว
แต่แอบอยากลองไอติมมะม่วง
แต่รอจิกของคนอื่นเอา 555555

มังคุดลอยแก้วน่าจะเป็นของยี่ห้ออื่น
เพราะมาเป็นก้อนน้ำเหมือนแกะจากถ้วยมา
ส่วนไอติมก็เหมือนกัน
รสชาติก็โอเค แต่ไอติมมะม่วงอร่อยดี <3
มะม๊วงงง มะม่วงงงงวง 


เอาว่า ใครชอบบรรยากาศ และอาหารที่สร้างสรรค์
ชอบปะทะคารมกับเจ้าของร้าน ก็ลองของได้ค่ะ","ทำบุญ,บ้าน,อิ่ม,บุญ,หลังจากนั้น,หา,อิ่ม,ท้อง,ดีกว่า,แถว,บรรยากาศ,ดี,อาหาร,แถว,ติด,ริมน้ำ,ญาติ,จอง,เอาไว้,คน,รีวิว,อาหาร,อร่อย,บรรยากาศ,ดี,ลอง,เมนู,ที่นี่,อาหาร,ไทย,ปน,อารมณ์,ศิลปิน,นิดนึง,ฟิวชั่น,ผัด,ไท,หมี่,กรอบ,ส้มตำ,มันแกว,อาหาร,ประยุกต์,น่าสนใจ,พูดถึง,รสชาติ,จาน,ปีก,ไก่ทอด,สมุนไพร,กรอ,บดี,เนื้อไก่,แน่น,แป้ง,แอบ,หนา,เหมือนกัน,อม,น้ำมัน,นะคะ,ญาติ,ชอบ,หมู,ตุ๋น,เห็ด,หอม,เมนู,แอบ,ตื่นเต้น,ตกแต่ง,จาน,สวย,กก,กก,ทาน,หมู,ตุ๋น,ผสม,บด,ทาน,ผัด,ผัก,บด,เนื้อ,ละเอียด,เลี่ยน,ผสม,เนื้อ,ตุ๋น,นุ่ม,เข้าเนื้อ,ปลา,กระ,พง,ทอด,น้ำปลา,ที่นี่,ปลา,เค้า,หั่น,ชิ้น,ทาน,น้ำ,ราด,หวาน,เค็ม,เปรี้ยว,ญาติ,ชอบ,บอ,สู้,แหล,แกงเขียวหวาน,หมู,ย่าง,แอบ,แปลกใจ,แกงเขียวหวาน,ใส่,ลำไย,ชิม,รสชาติ,โอเค,คอ,หมู,ย่าง,ชิ้น,ดี,มาถึง,จาน,ชอบ,เป็นพิเศษ,ส้มตำ,มันแกว,ปกติ,คน,ชอบ,ทาน,มันแกว,จืด,น้ำ,โรคกลัวน้ำ,5555,บอ,อันนี้,อร่อย,จาน,ที่ผ่านมา,อาหาร,ทอด,เลี่ยน,รสชาติ,เปรี้ยว,อม,หวาน,ตัด,เลี่ยน,จาน,ชอบ,ยำ,วุ้นเส้น,รสชาติ,อี,กก,กก,ปลื้ม,มมมมม,กุ้ง,ตัว,ตตต,เต็ม,ของคาว,แล้วก็,ของหวาน,อิ,อิ,ที่นี่,ลอยแก้ว,ไอติม,ดู,เมนู,สั่ง,ไอติม,กิน,ผลไม้,นิดนึง,สั่ง,มังคุด,ลอยแก้ว,แอบ,ลอง,ไอติม,มะม่วง,รอ,จิก,คนอื่น,555555,มังคุด,ลอยแก้ว,น่าจะเป็น,ยี่ห้อ,ก้อน,น้ำ,เหมือน,แกะ,ถ้วย,ไอติม,เหมือนกัน,รสชาติ,โอเค,ไอติม,มะม่วง,อร่อย,ดี,มะ,ม๊วงงง,มะม่วง,งง,งวง,ชอบ,บรรยากาศ,อาหาร,สร้างสรรค์,ชอบ,ปะทะคารม,เจ้าของ,ลองของ"
225,226,"เบเกอร์รี่อร่อยดี มีให้เลือกหลากหลาย ไอติมมีหลายรส อร่อยมาก
เครื่องดื่มเป็นพวกชา/กาแฟอะไรทั่วๆไปอ่ะ อร่อยดี
ของคาวเคยกินแต่มาม่า อร่อยและน่ากินมาก
ชอบที่สุดคือบรรยากาศร้าน โต๊ะวางห่างๆไม่ชิดกันมาก เป็นส่วนตัวดี ไม่อึดอัด นั่งชิลอ่านหนังสือ/ทำงานได้ทั้งวัน คนไม่วุ่นวายแม้ยามเปิดเทอม ชอบๆ
แต่ราคาแอบแพงนะ จริงๆก็เท่าๆร้านข้างนอกทั่วไปแหละ แต่อยากให้ราคานักศึกษามากกว่านี้ มากินทุกวันคงหมดตัวโดยไม่รู้ตัวแน่ แต่ก็อยากมาอีกนะ","เบ,เก,อร,รี่,อร่อย,ดี,เลือก,หลากหลาย,ไอติม,รส,อร่อย,เครื่องดื่ม,ชา,กาแฟ,อ่ะ,อร่อย,ดี,ของคาว,กิน,มาม่า,อร่อย,น่ากิน,ชอบ,บรรยากาศ,โต๊ะ,วาง,ห่าง,ชิด,ตัวดี,อึดอัด,นั่ง,ชิล,อ่านหนังสือ,ทำงาน,ทั้งวัน,คน,วุ่นวาย,ยาม,เปิดเทอม,ชอบ,ราคา,แอบ,แพง,ข้างนอก,ทั่วไป,ให้ราคา,นักศึกษา,กิน,หมดตัว,โดยไม่รู้ตัว,แน่"
226,227,"ร้านตั้งอยู่ชั้นล่าง ของโลตัส ศาลายา
อยู่เยื้องๆ ม. มหิดล ถนน บรมราชชนนี
หาง่ายครับ

คุณภาพ มาตรฐาน
นอกจากกาแฟอร่อยแล้ว 
โกโก้ เขาแถมนมข้น และ ขนมปังด้วย
ยังมีอาหารหลากหลายชนิด แก้หิวอีก

วันนั้น ลองสั่ง สปาเก๊ตตี้ ผัดกับ แฮมทอด รสจัดถูกใจคนไทยดีครับ
นอกนั้นปลาลวกจิ้ม ก็อร่อย ไม่เหม็นคาว
สเตีกปลา
ราดหน้าเกี๊ยวกรอบ

อาหารก็คุณภาพได้มาตรฐาน ไม่มีอะไรโดดเด่นนัก
ผมว่าน่าจะลดชนิดเมนูลงบ้าง แต่เน้นอาหารที่อร่อยจริงๆ สัก 5 - 6 อย่าง น่าจะดีนะครับ

","ตั้งอยู่,ชั้นล่าง,โลตัส,ศาลา,ยา,เยื้อง,มหิดล,ถนน,บรม,ราช,ชนนี,หา,คุณภาพ,มาตรฐาน,กาแฟ,อร่อย,โกโก้,แถม,นมข้น,ขนมปัง,ยังมี,อาหาร,หลาก,หลายชนิด,แก้,หิว,ลอง,สั่ง,สปา,เก๋,ตตี้,ผัด,แฮม,ทอด,รสจัด,ถูกใจ,คนไทย,ดี,ปลา,ลวก,จิ้ม,อร่อย,เหม็นคาว,เต,ีก,ปลา,ราดหน้า,เกี๊ยว,กรอบ,อาหาร,คุณภาพ,ได้มาตรฐาน,โดดเด่น,ลด,ชนิด,เมนู,อาหาร,อร่อย,สัก,ดี"
